{
  "system": {
    "keymanDeveloperVersion": "16.0.60.0",
    "fileVersion": "7.0"
  },
  "options": {
    "readmeFile": "readme.htm",
    "graphicFile": "splash.gif"
  },
  "info": {
    "name": {
      "description": "Khmer Angkor"
    },
    "copyright": {
      "description": "\u00A9 2015-2022 SIL International"
    },
    "author": {
      "description": "Makara Sok",
      "url": "mailto:makara_sok@sil.org"
    },
    "version": {
      "description": "1.3"
    },
    "website": {
      "description": "https://keyman.com/keyboards/khmer_angkor",
      "url": "https://keyman.com/keyboards/khmer_angkor"
    },
    "description": {
      "description": "<h1>Khmer Angkor</h1>\n<p>Khmer Unicode keyboard layout based on the NiDA keyboard layout. Automatically corrects many common keying errors, including:</p>\n<ul>\n<li>Using wrong vowel combination</li>\n<li>Typing clusters out of order</li>\n<li>Typing wrong mark for consonant shifters</li>\n<li>And more!</li>\n</ul>"
    }
  },
  "files": [
    {
      "name": "khmer_angkor.js",
      "description": ""
    },
    {
      "name": "khmer_angkor.kvk",
      "description": ""
    },
    {
      "name": "khmer_angkor.kmx",
      "description": ""
    },
    {
      "name": "keyboard_layout.png",
      "description": ""
    },
    {
      "name": "welcome.htm",
      "description": ""
    },
    {
      "name": "FONTLOG.txt",
      "description": ""
    },
    {
      "name": "Mondulkiri-R.ttf",
      "description": ""
    },
    {
      "name": "OFL.txt",
      "description": ""
    },
    {
      "name": "OFL-FAQ.txt",
      "description": ""
    },
    {
      "name": "KAK_Documentation_EN.pdf",
      "description": ""
    },
    {
      "name": "KAK_Documentation_KH.pdf",
      "description": ""
    },
    {
      "name": "readme.htm",
      "description": ""
    },
    {
      "name": "image002.png",
      "description": ""
    },
    {
      "name": "khmer_busra_kbd.ttf",
      "description": ""
    },
    {
      "description": "",
      "name": "DejaVuSans.ttf"
    },
    {
      "name": "splash.gif",
      "description": ""
    },
    {
      "name": "kmp.inf",
      "description": ""
    },
    {
      "name": "kmp.json",
      "description": ""
    }
  ],
  "keyboards": [
    {
      "name": "Khmer Angkor",
      "id": "khmer_angkor",
      "version": "1.3",
      "oskFont": "khmer_busra_kbd.ttf",
      "displayFont": "Mondulkiri-R.ttf",
      "webOskFonts": ["khmer_busra_kbd.ttf"],
      "webDisplayFonts": ["DejaVuSans.ttf"],
      "languages": [
        {
          "name": "Central Khmer (Khmer, Cambodia)",
          "id": "km"
        }
      ],
      "examples": [
        {
          "id": "km",
          "keys": "x j m E r",
          "text": "ខ្មែរ",
          "note": "Name of language"
        },
        {
          "id": "km",
          "keys": "B j r H r a C a N a c k j r k m j B u C a",
          "text": "ព្រះរាជាណាចក្រកម្ពុជា",
          "note": "'Kingdom of Cambodia'"
        }
      ]
    }
  ],
  "relatedPackages": [
    { "id": "modern_khmer", "relationship": "deprecates" },
    { "id": "khmer_nida", "relationship": "related" }
  ]
}
