{
  "system": {
    "keymanDeveloperVersion": "17.0.91.0",
    "fileVersion": "7.0"
  },
  "options": {
    "readmeFile": "readme.htm"
  },
  "startMenu": {
    "folder": "ahom_star",
    "addUninstallEntry": true,
    "items": [
      {
        "name": "(new)",
        "filename": "(Product Configuration)",
        "arguments": "shom_star"
      },
      {
        "name": "(new)",
        "filename": "Ahom_star.kvk",
        "arguments": "Ahom fonts"
      }
    ]
  },
  "info": {
    "version": {
      "description": "1.0.1"
    },
    "name": {
      "description": "Ahom Star"
    },
    "copyright": {
      "description": "\u00A9 2021-2022 HemantaGogoi Ngi Mon"
    },
    "author": {
      "description": "Dr Hemanta Kumar Gogoi",
      "url": "mailto:drhemanta97@gmail.com"
    }
  },
  "files": [
    {
      "name": "ahom_star.kvk",
      "description": ""
    },
    {
      "name": "ahom_star.kmx",
      "description": ""
    },
    {
      "name": "ahom_star.js",
      "description": ""
    },
    {
      "name": "welcome.htm",
      "description": ""
    },
    {
      "name": "desktop_layout_default.png",
      "description": ""
    },
    {
      "name": "desktop_layout_shift.png",
      "description": ""
    },
    {
      "name": "phone_default.png",
      "description": ""
    },
    {
      "name": "phone_longpress.png",
      "description": ""
    },
    {
      "name": "phone_numeric.png",
      "description": ""
    },
    {
      "name": "phone_shift.png",
      "description": ""
    },
    {
      "name": "readme.htm",
      "description": ""
    },
    {
      "name": "NotoSerifAhom-Regular.ttf",
      "description": ""
    },
    {
      "name": "kmp.inf",
      "description": ""
    },
    {
      "name": "kmp.json",
      "description": ""
    }
  ],
  "keyboards": [
    {
      "name": "Ahom Star",
      "id": "ahom_star",
      "version": "1.0.1",
      "oskFont": "NotoSerifAhom-Regular.ttf",
      "displayFont": "NotoSerifAhom-Regular.ttf",
      "languages": [
        {
          "name": "Ahom (Ahom)",
          "id": "aho-Ahom"
        }
      ]
    }
  ]
}
