{
  "system": {
    "keymanDeveloperVersion": "10.0.1202.0",
    "fileVersion": "7.0"
  },
  "options": {
    "readmeFile": "readme.htm"
  },
  "info": {
    "version": {
      "description": "1.6.1"
    },
    "name": {
      "description": "LIBTRALO"
    },
    "copyright": {
      "description": "\u00A9 2008-2018 SIL Global"
    },
    "author": {
      "description": "support@keyman.com",
      "url": "mailto:support@keyman.com"
    }
  },
  "files": [
    {
      "name": "libtralo.kmx",
      "description": "Keyboard LIBTRALO"
    },
    {
      "name": "readme.htm",
      "description": "File readme.htm"
    },
    {
      "name": "libtralo.png",
      "description": "File libtralo.png"
    },
    {
      "name": "welcome.htm",
      "description": "File welcome.htm"
    },
    {
      "name": "Charis_SIL_README.txt",
      "description": "File Charis_SIL_README.txt"
    },
    {
      "name": "CharisSIL-B.ttf",
      "description": "Font Charis SIL Bold"
    },
    {
      "name": "CharisSIL-BI.ttf",
      "description": "Font Charis SIL Bold Italic"
    },
    {
      "name": "CharisSIL-I.ttf",
      "description": "Font Charis SIL Italic"
    },
    {
      "name": "CharisSIL-R.ttf",
      "description": "Font Charis SIL"
    },
    {
      "name": "FONTLOG.txt",
      "description": "File FONTLOG.txt"
    },
    {
      "name": "OFL.txt",
      "description": "File OFL.txt"
    },
    {
      "name": "OFL-FAQ.txt",
      "description": "File OFL-FAQ.txt"
    },
    {
      "name": "CharisSILDan-Bold.ttf",
      "description": "Font Charis SIL Dan Bold"
    },
    {
      "name": "CharisSILDan-BoldItalic.ttf",
      "description": "Font Charis SIL Dan Bold Italic"
    },
    {
      "name": "CharisSILDan-Italic.ttf",
      "description": "Font Charis SIL Dan Italic"
    },
    {
      "name": "CharisSILDan-Regular.ttf",
      "description": "Font Charis SIL Dan"
    },
    {
      "name": "libtralo.js",
      "description": "File libtralo.js"
    },
    {
      "name": "libtralo.kvk",
      "description": "File libtralo.kvk"
    },
    {
      "name": "CharisSILDan_FONTLOG.txt",
      "description": "File CharisSILDan_FONTLOG.txt"
    },
    {
      "name": "kmp.inf",
      "description": "Package information"
    },
    {
      "name": "kmp.json",
      "description": "Package information (JSON)"
    }
  ],
  "keyboards": [
    {
      "name": "LIBTRALO",
      "id": "libtralo",
      "version": "1.6.1",
      "languages": [
        {
          "name": "Bandi",
          "id": "bza-Latn"
        },
        {
          "name": "Bassa",
          "id": "bsq-Latn"
        },
        {
          "name": "Glio-Oubi",
          "id": "oub-Latn"
        },
        {
          "name": "Gola",
          "id": "gol-Latn"
        },
        {
          "name": "Northern Grebo",
          "id": "gbo-Latn"
        },
        {
          "name": "Southern Kisi",
          "id": "kss-Latn"
        },
        {
          "name": "Klao",
          "id": "klu-Latn"
        },
        {
          "name": "Liberia Kpelle (Latin)",
          "id": "xpe-Latn"
        },
        {
          "name": "Eastern Krahn",
          "id": "kqo-Latn"
        },
        {
          "name": "Western Krahn",
          "id": "krw-Latn"
        },
        {
          "name": "Kuwaa",
          "id": "blh-Latn"
        },
        {
          "name": "Loma (Liberia) (Latin)",
          "id": "lom-Latn"
        },
        {
          "name": "Mano",
          "id": "mev-Latn"
        },
        {
          "name": "Manya",
          "id": "mzj-Latn"
        },
        {
          "name": "Sapo",
          "id": "krn-Latn"
        },
        {
          "name": "Bullom So",
          "id": "buy-Latn"
        },
        {
          "name": "Kono (Sierra Leone)",
          "id": "kno-Latn"
        },
        {
          "name": "Krio",
          "id": "kri-Latn"
        },
        {
          "name": "Kuranko",
          "id": "knk-Latn"
        },
        {
          "name": "West-Central Limba",
          "id": "lia-Latn"
        },
        {
          "name": "Loko",
          "id": "lok-Latn"
        },
        {
          "name": "Mende (Sierra Leone)",
          "id": "men"
        },
        {
          "name": "Timne",
          "id": "tem"
        },
        {
          "name": "Vai (Latin)",
          "id": "vai-Latn"
        },
        {
          "name": "Dewoin (Latin)",
          "id": "dee-Latn"
        },
        {
          "name": "Dan (Western) (Latin)",
          "id": "dnj-Latn-LR"
        },
        {
          "name": "Gbii (Latin)",
          "id": "ggb-Latn"
        },
        {
          "name": "Glaro-Twabo (Latin)",
          "id": "glr-Latn"
        },
        {
          "name": "Grebo (Latin)",
          "id": "grb-Latn"
        },
        {
          "name": "Barclayville Grebo (Latin)",
          "id": "gry-Latn"
        },
        {
          "name": "Central Grebo (Latin)",
          "id": "grv-Latn"
        },
        {
          "name": "Gboloo Grebo (Latin)",
          "id": "gec-Latn"
        },
        {
          "name": "Southern Grebo (Latin)",
          "id": "grj-Latn"
        },
        {
          "name": "Kpelle (Latin)",
          "id": "kpe-Latn"
        },
        {
          "name": "Tajuasohn (Latin)",
          "id": "tja-Latn"
        },
        {
          "name": "Bom-Kim (Latin)",
          "id": "bmf-Latn"
        },
        {
          "name": "Sherbro (Latin)",
          "id": "bun-Latn"
        }
      ]
    }
  ]
}
